{
  "id": "review_packet.maya.southern-abrasives-opportunity",
  "created_at": "2026-04-28T16:09:00Z",
  "trigger": {
    "id": "trigger.maya.southern-abrasives-opportunity",
    "source": "agent_reasoning",
    "created_at": "2026-04-28T16:09:00Z",
    "actor_ref": "persona.maya",
    "summary": "Maya reviewed a context package for the Southern Abrasives won deal as a possible marketing opportunity.",
    "payload": {
      "context_package_ref": "context.maya.southern-abrasives-won-opportunity",
      "recent_change_ref": "recent.linear.southern-abrasives-won"
    },
    "evidence_refs": [
      "context.maya.southern-abrasives-won-opportunity",
      "recent.linear.southern-abrasives-won",
      "journal.sampleco.deal.southern-abrasives.won"
    ],
    "candidate_state_refs": [
      "state.sampleco.deal.southern-abrasives",
      "state.operating_picture.marketing"
    ],
    "candidate_memory_refs": [
      "memory.maya.marketing.draft.audience-before-copy"
    ],
    "persona_ref": "persona.maya",
    "governance_refs": [
      "governance.external-copy-approval"
    ]
  },
  "evidence_packet": {
    "evidence_refs": [
      "context.maya.southern-abrasives-won-opportunity",
      "recent.linear.southern-abrasives-won",
      "journal.sampleco.deal.southern-abrasives.won"
    ],
    "resolved_evidence": [
      {
        "ref": "context.maya.southern-abrasives-won-opportunity",
        "summary": "Maya's package includes a won deal, unresolved public naming permission, external-copy governance, and excluded operational handoff detail.",
        "source_type": "context_package",
        "observed_at": "2026-04-28T16:08:00Z"
      }
    ],
    "unresolved_evidence_refs": [
      "linear:deal:southern-abrasives.public-announcement-permission",
      "linear:deal:southern-abrasives.approved-proof-point"
    ]
  },
  "state_context": {
    "snapshots": [
      {
        "id": "state.sampleco.deal.southern-abrasives",
        "type": "deal",
        "summary": "Southern Abrasives moved to won in Linear, creating an operational handoff and a possible marketing proof-point opportunity, but public naming and external announcement permission remain unresolved.",
        "status": "won"
      },
      {
        "id": "state.operating_picture.marketing",
        "type": "operating_picture",
        "summary": "Marketing state is in early formation. Recent deal movement may create proof-point opportunities, but external copy requires approval."
      }
    ]
  },
  "journal_context": {
    "recent_entries": [
      {
        "id": "journal.sampleco.deal.southern-abrasives.won",
        "state_object_id": "state.sampleco.deal.southern-abrasives",
        "interpretation": "Southern Abrasives moved to won in Linear, creating both operational handoff needs and a possible marketing proof-point opportunity."
      }
    ]
  },
  "memory_context": {
    "entries": [
      {
        "id": "memory.maya.marketing.draft.audience-before-copy",
        "summary": "Maya is noticing that campaign quality depends on defining audience and proof before copy.",
        "confidence": 0.65,
        "status": "draft"
      }
    ]
  },
  "persona_context": {
    "persona": {
      "id": "persona.maya",
      "name": "Maya",
      "role": "Marketing agent",
      "watched_domains": [
        "campaign",
        "relationship",
        "deal",
        "project",
        "operating_picture"
      ],
      "authority_boundaries": [
        "May draft internal positioning and campaign recommendations autonomously.",
        "Requires approval before publishing external-facing copy.",
        "Requires approval before making commitments to customers, partners, or vendors."
      ]
    }
  },
  "governance_context": {
    "constraints": [
      {
        "id": "governance.external-copy-approval",
        "summary": "External-facing campaign copy requires approval before publication.",
        "approval_required": true
      }
    ]
  },
  "allowed_outputs": [
    "no_op",
    "state_proposal",
    "memory_proposal",
    "promotion_proposal",
    "action_proposal",
    "rollup_request",
    "missing_evidence",
    "review_signal"
  ]
}
