{
  "id": "review_packet.patrick.harbor-contract-stale",
  "created_at": "2026-04-28T14:11:00Z",
  "trigger": {
    "id": "trigger.patrick.harbor-contract-stale",
    "source": "scheduled_review",
    "created_at": "2026-04-28T14:10:00Z",
    "actor_ref": "persona.patrick",
    "summary": "Scheduled operations review found the Harbor contract record lacks explicit owner, current stage, next action, and canonical Drive archive reference.",
    "payload": {
      "review_type": "operations_record_hygiene",
      "record": "Harbor contract obligation",
      "gaps": [
        "owner unclear",
        "current stage unclear",
        "next action unclear",
        "canonical Drive archive missing"
      ]
    },
    "evidence_refs": [
      "lfw-process/pipeline/ops-manager-operating-model.md",
      "state.lfw.contract.harbor"
    ],
    "candidate_state_refs": [
      "state.lfw.contract.harbor",
      "state.lfw.operating_picture.ops"
    ],
    "candidate_memory_refs": [],
    "persona_ref": "persona.patrick",
    "governance_refs": [
      "governance.contract-external-action-approval",
      "governance.source-of-truth-discipline"
    ]
  },
  "evidence_packet": {
    "evidence_refs": [
      "lfw-process/pipeline/ops-manager-operating-model.md",
      "state.lfw.contract.harbor"
    ],
    "resolved_evidence": [
      {
        "ref": "lfw-process/pipeline/ops-manager-operating-model.md",
        "summary": "The ops manager role centralizes operational discipline, follow-up, document control, weekly summaries, and source-of-truth hygiene while avoiding legal, sales, finance, and delivery authority.",
        "source_type": "local_doc",
        "observed_at": "2026-04-28T14:00:00Z"
      },
      {
        "ref": "state.lfw.contract.harbor",
        "summary": "The Harbor obligation state exists but lacks evidenced owner, current contract stage, next action, and retained Drive archive reference.",
        "source_type": "state_snapshot",
        "observed_at": "2026-04-28T14:05:00Z"
      }
    ],
    "unresolved_evidence_refs": [
      "drive.lfw.contracts.harbor.current",
      "linear.lfw.harbor-contract-owner"
    ]
  },
  "state_context": {
    "snapshots": [
      {
        "id": "state.lfw.contract.harbor",
        "type": "obligation",
        "summary": "Harbor appears to have an active or recently active contract obligation, but the current owner, stage, next action, and retained Drive source are not explicit in State System fixtures.",
        "status": "waiting_on_internal",
        "open_questions": [
          "Who owns Harbor contract follow-up?",
          "What is the current Harbor contract stage?",
          "Where is the canonical Drive document or retained archive reference?",
          "Does any next action require legal, sales, or leadership approval?"
        ],
        "parent_state_refs": [
          "state.lfw.operating_picture.ops"
        ]
      },
      {
        "id": "state.lfw.operating_picture.ops",
        "type": "operating_picture",
        "summary": "LFW operations need a compact view of active obligations, contracts, document control, delivery handoffs, finance admin, and follow-up risks.",
        "child_state_refs": [
          "state.lfw.contract.harbor"
        ]
      }
    ]
  },
  "journal_context": {
    "recent_entries": [
      {
        "id": "journal.lfw.contract.harbor.initial",
        "state_object_id": "state.lfw.contract.harbor",
        "interpretation": "Harbor should be treated as an operational obligation candidate until owner, stage, source document, and approval boundary are clarified."
      }
    ]
  },
  "memory_context": {
    "entries": []
  },
  "persona_context": {
    "persona": {
      "id": "persona.patrick",
      "name": "Patrick",
      "role": "Operations manager agent",
      "watched_domains": [
        "operating_picture",
        "obligation",
        "project",
        "deal",
        "relationship",
        "onboarding",
        "governance",
        "contract_document_control"
      ],
      "authority_boundaries": [
        "May propose operational state changes and internal follow-up actions autonomously.",
        "May request missing evidence and canonical source references autonomously.",
        "Requires approval before sending, signing, or approving contracts.",
        "Requires approval before creating external commitments or changing legal, accounting, sales, or delivery decisions."
      ]
    }
  },
  "governance_context": {
    "constraints": [
      {
        "id": "governance.contract-external-action-approval",
        "summary": "Sending, signing, approving, or externally committing contract actions requires human approval.",
        "approval_required": true
      },
      {
        "id": "governance.source-of-truth-discipline",
        "summary": "Operational records should cite the canonical system before being treated as actionable fact.",
        "approval_required": false
      }
    ]
  },
  "allowed_outputs": [
    "no_op",
    "state_proposal",
    "memory_proposal",
    "promotion_proposal",
    "action_proposal",
    "rollup_request",
    "missing_evidence",
    "review_signal"
  ]
}
